{
  "version": "0.1.0",
  "fuenteBase": "Documento maestro de formación no reglada en inteligencia artificial para el Servicio Canario de Empleo",
  "nota": "Inventario inicial orientativo. Debe revisarse contra las fichas oficiales antes de publicación docente.",
  "formaciones": [
    {
      "codigo": "IFCT117",
      "denominacion": "Introducción a la inteligencia artificial",
      "horas": 25,
      "familiaArea": "Informática y comunicaciones",
      "tipoPieza": "especialidad formativa no formal",
      "nivelEstimado": "Nivel 1",
      "publicoModalidad": "Ocupados, teleformación; visible también en programación",
      "fuente": {
        "etiqueta": "SCE Buscur",
        "url": "https://www3.gobiernodecanarias.org/empleo/buscur/detail/2-FOIFCT117"
      },
      "observacionesPedagogicas": "Entrada breve para conceptos, aplicaciones y liderazgo inicial en proyectos de datos e IA."
    },
    {
      "codigo": "IFCT0049",
      "denominacion": "ChatGPT e inteligencia artificial",
      "horas": 60,
      "familiaArea": "Informática y comunicaciones",
      "tipoPieza": "especialidad formativa no formal",
      "nivelEstimado": "Nivel 1",
      "publicoModalidad": "Ocupados, teleformación; desempleados, presencial",
      "fuente": {
        "etiqueta": "SCE Buscur",
        "url": "https://www3.gobiernodecanarias.org/empleo/buscur/detail/2-FOIFCT0049"
      },
      "observacionesPedagogicas": "Útil para alfabetización en IA generativa, límites, avances y aplicaciones prácticas."
    },
    {
      "codigo": "COMM0032",
      "denominacion": "Revolución artificial: uso y aplicaciones de ChatGPT en el entorno digital",
      "horas": 60,
      "familiaArea": "Comercio y marketing",
      "tipoPieza": "especialidad formativa no formal",
      "nivelEstimado": "Nivel 1",
      "publicoModalidad": "Ocupados, teleformación; desempleados, presencial",
      "fuente": {
        "etiqueta": "SCE Buscur",
        "url": "https://www3.gobiernodecanarias.org/empleo/buscur/detail/2-FOCOMM0032"
      },
      "observacionesPedagogicas": "Buen apoyo para introducción a ChatGPT, uso básico, ética y recursos adicionales."
    },
    {
      "codigo": "IFCD0099",
      "denominacion": "Inteligencia artificial generativa y mejora de la productividad",
      "horas": 90,
      "familiaArea": "Informática y comunicaciones",
      "tipoPieza": "especialidad formativa no formal",
      "nivelEstimado": "Nivel 2",
      "publicoModalidad": "Ocupados, teleformación",
      "fuente": {
        "etiqueta": "SCE Buscur",
        "url": "https://www3.gobiernodecanarias.org/empleo/buscur/detail/2-FOIFCD0099"
      },
      "observacionesPedagogicas": "Encaja con productividad, IA generativa, visualización de datos y mejora de tareas cotidianas."
    },
    {
      "codigo": "IFCT0073",
      "denominacion": "Mejora tu productividad con inteligencia artificial",
      "horas": 100,
      "familiaArea": "Informática y comunicaciones",
      "tipoPieza": "especialidad formativa no formal",
      "nivelEstimado": "Nivel 2",
      "publicoModalidad": "Ocupados y desempleados, presencial",
      "fuente": {
        "etiqueta": "SCE Buscur",
        "url": "https://www3.gobiernodecanarias.org/empleo/buscur/detail/2-FOIFCT0073"
      },
      "observacionesPedagogicas": "Aterriza texto, imagen, audio, vídeo, atención al cliente y análisis de sentimientos."
    },
    {
      "codigo": "COMM04",
      "denominacion": "Introducción a la inteligencia artificial aplicada al marketing",
      "horas": 50,
      "familiaArea": "Comercio y marketing",
      "tipoPieza": "especialidad formativa no formal",
      "nivelEstimado": "Nivel 3",
      "publicoModalidad": "Ocupados y desempleados; presencial y teleformación visibles",
      "fuente": {
        "etiqueta": "SCE Buscur",
        "url": "https://www3.gobiernodecanarias.org/empleo/buscur/detail/2-FOCOMM04"
      },
      "observacionesPedagogicas": "Puente sectorial hacia marketing, modelos predictivos no-code y agentes inteligentes."
    },
    {
      "codigo": "COMM18",
      "denominacion": "Inteligencia artificial aplicada a marketing digital",
      "horas": 200,
      "familiaArea": "Comercio y marketing",
      "tipoPieza": "especialidad formativa no formal",
      "nivelEstimado": "Nivel 3",
      "publicoModalidad": "Desempleados, presencial",
      "fuente": {
        "etiqueta": "SCE Buscur",
        "url": "https://www3.gobiernodecanarias.org/empleo/buscur/detail/2-FPCOMM18"
      },
      "observacionesPedagogicas": "Curso largo para martech, datos, e-commerce, automatización y business case."
    },
    {
      "codigo": "COMM0042",
      "denominacion": "Personalización de la experiencia del cliente con inteligencia artificial",
      "horas": 60,
      "familiaArea": "Comercio y marketing",
      "tipoPieza": "especialidad formativa no formal",
      "nivelEstimado": "Nivel 3",
      "publicoModalidad": "Ocupados, teleformación; desempleados, presencial",
      "fuente": {
        "etiqueta": "SCE Buscur",
        "url": "https://www3.gobiernodecanarias.org/empleo/buscur/detail/2-FOCOMM0042"
      },
      "observacionesPedagogicas": "Adecuado para segmentación, UX, personalización y automatización de campañas."
    },
    {
      "codigo": "COMM0033",
      "denominacion": "Revolución artificial: herramientas de inteligencia artificial aplicadas al comercio tradicional",
      "horas": 60,
      "familiaArea": "Comercio y marketing",
      "tipoPieza": "especialidad formativa no formal",
      "nivelEstimado": "Nivel 3",
      "publicoModalidad": "Ocupados, teleformación; desempleados, presencial",
      "fuente": {
        "etiqueta": "SCE Buscur",
        "url": "https://www3.gobiernodecanarias.org/empleo/buscur/detail/2-FOCOMM0033"
      },
      "observacionesPedagogicas": "Aplicación a pequeño comercio, recomendaciones, precios, inventario, marketing y chatbots."
    },
    {
      "codigo": "FCOO0009",
      "denominacion": "Aplicaciones basadas en inteligencia artificial de uso en orientación laboral",
      "horas": 120,
      "familiaArea": "Formación complementaria / orientación laboral",
      "tipoPieza": "especialidad formativa no formal",
      "nivelEstimado": "Nivel 3",
      "publicoModalidad": "Desempleados, presencial",
      "fuente": {
        "etiqueta": "SCE Buscur",
        "url": "https://www3.gobiernodecanarias.org/empleo/buscur/detail/2-FPFCOO0009"
      },
      "observacionesPedagogicas": "La ficha revisada no desglosa módulos; útil para empleabilidad y orientación con prudencia profesional."
    },
    {
      "codigo": "IFCT0019",
      "denominacion": "Inteligencia artificial aplicada a la empresa",
      "horas": 280,
      "familiaArea": "Informática y comunicaciones / empresa",
      "tipoPieza": "especialidad formativa no formal",
      "nivelEstimado": "Nivel 4",
      "publicoModalidad": "Ocupados, teleformación; desempleados, presencial",
      "fuente": {
        "etiqueta": "SCE Buscur",
        "url": "https://www3.gobiernodecanarias.org/empleo/buscur/detail/2-FOIFCT0019"
      },
      "observacionesPedagogicas": "Curso extenso para algoritmos, ML, deep learning, big data y herramientas como Weka u Orange."
    },
    {
      "codigo": "IFCD104",
      "denominacion": "Inteligencia artificial y big data aplicado al ámbito biosanitario",
      "horas": 300,
      "familiaArea": "Informática y comunicaciones / salud",
      "tipoPieza": "especialidad formativa no formal",
      "nivelEstimado": "Nivel 4",
      "publicoModalidad": "Ocupados, teleformación; desempleados, presencial",
      "fuente": {
        "etiqueta": "SCE Buscur",
        "url": "https://www3.gobiernodecanarias.org/empleo/buscur/detail/2-FOIFCD104"
      },
      "observacionesPedagogicas": "Nivel técnico-sectorial: programación, modelos, Big Data, R, estadística y tecnologías hospitalarias."
    },
    {
      "codigo": "IFCD107",
      "denominacion": "Especialista en inteligencia artificial",
      "horas": 230,
      "familiaArea": "Informática y comunicaciones",
      "tipoPieza": "especialidad formativa no formal",
      "nivelEstimado": "Nivel 4",
      "publicoModalidad": "Desempleados, presencial",
      "fuente": {
        "etiqueta": "SCE Buscur",
        "url": "https://www3.gobiernodecanarias.org/empleo/buscur/detail/2-FPIFCD107"
      },
      "observacionesPedagogicas": "Conecta fundamentos, datasets, ML, redes neuronales, AutoML, Responsible AI y soft skills."
    },
    {
      "codigo": "IFCT0067",
      "denominacion": "Administrador especialista Microsoft 365 con inteligencia artificial",
      "horas": 150,
      "familiaArea": "Informática y comunicaciones / productividad empresarial",
      "tipoPieza": "especialidad formativa no formal",
      "nivelEstimado": "Nivel 3",
      "publicoModalidad": "Desempleados, presencial",
      "fuente": {
        "etiqueta": "SCE Buscur",
        "url": "https://www3.gobiernodecanarias.org/empleo/buscur/detail/2-FPIFCT0067"
      },
      "observacionesPedagogicas": "Especialización instrumental vinculada a MS-900, MD-102 y MS-102."
    },
    {
      "codigo": "IFCT0070",
      "denominacion": "Consultor especialista de Power Platform con inteligencia artificial",
      "horas": 160,
      "familiaArea": "Informática y comunicaciones / automatización",
      "tipoPieza": "especialidad formativa no formal",
      "nivelEstimado": "Nivel 3",
      "publicoModalidad": "Desempleados, presencial",
      "fuente": {
        "etiqueta": "SCE Buscur",
        "url": "https://www3.gobiernodecanarias.org/empleo/buscur/detail/2-FPIFCT0070"
      },
      "observacionesPedagogicas": "Adecuado para automatización low-code y análisis con Power Platform."
    },
    {
      "codigo": "IFCD112",
      "denominacion": "Resolución de problemas multisectoriales: modelos de Machine Learning, Deep Learning y uso masivo de datos",
      "horas": 100,
      "familiaArea": "Informática y comunicaciones",